{
  "schema_version": "3.0",
  "captured_at": "2026-07-24T08:47:32.375968Z",
  "repository": {
    "repo_id": "huggingface/optimum",
    "url": "https://github.com/huggingface/optimum.git",
    "commit_sha": "a6c775e11118d62712057bd3a8c5649898a5312d",
    "raw_python_files": 74,
    "processed_python_files": 61,
    "baseline_python_lines": 13807,
    "modified_python_lines": 13814,
    "parseable_files": 61,
    "parse_success_rate": 1.0
  },
  "replay_file": {
    "path": "optimum/version.py",
    "file_id": "867c06c1f6e594bef9a16137312503a0870399626a16dded522ce7a24143b1a7",
    "git_diff": "diff --git a/optimum/version.py b/optimum/version.py\nindex bb061c5..a41eacc 100644\n--- a/optimum/version.py\n+++ b/optimum/version.py\n@@ -13,3 +13,10 @@\n #  limitations under the License.\n \n __version__ = \"2.2.0.dev0\"\n+\n+\n+def lab04_replay_probe(value):\n+    \"\"\"Small deterministic branch used only by the Lab 04 replay demo.\"\"\"\n+    if value > 10:\n+        return value * 2\n+    return value",
    "backup_path": "tmp\\replay-backups\\version-20260724-154438.py.bak"
  },
  "connector_status": {
    "name": "cpg-neo4j-sink",
    "connector": {
      "state": "RUNNING",
      "worker_id": "connect:8083"
    },
    "tasks": [
      {
        "id": 0,
        "state": "RUNNING",
        "worker_id": "connect:8083"
      }
    ],
    "type": "sink"
  },
  "parser_error_fixture": {
    "repo_id": "fixture/invalid",
    "processed": 0,
    "skipped": 0,
    "errors": 1,
    "files": [
      {
        "path": "broken.py",
        "file_id": "588c74ea0f8771aa5a93280dd7211bd83afc52bf9e65d495c6cc6549d74705d4",
        "content_hash": "599a559122e3d4740cd8d47ecc76045c0c2310653235cfc102190b8f96f2182f",
        "status": "error",
        "nodes": 0,
        "edges": 0,
        "deleted_nodes": 0,
        "deleted_edges": 0,
        "warnings": 0,
        "error": "invalid syntax (broken.py, line 1)"
      }
    ]
  },
  "kafka_samples": {
    "cpg.nodes.v1": {
      "source": "Kafka broker via read_committed kafka-console-consumer",
      "key": "b6569b0fda5380bcc1f06d903ea04c6654a7795938904c1a0fce0061449165d3",
      "value": {
        "schema_version": "1.0",
        "event_time": "2026-07-20T05:56:53.556796Z",
        "repo_id": "huggingface/optimum",
        "file_id": "c6ae6f5556f2b93b05a9f09c6c2907e8b49239a4167a4f0a4e766b7b9ce4ace2",
        "run_id": "0e24e3e515da407eb97fb170c9e4fa69",
        "content_hash": "d9981103fcb1b057d82d44e24781f1e0547d9dca5212450da54eac55089a777a",
        "op": "upsert",
        "node": {
          "id": "b6569b0fda5380bcc1f06d903ea04c6654a7795938904c1a0fce0061449165d3",
          "kind": "AST",
          "ast_type": "Module",
          "file_id": "c6ae6f5556f2b93b05a9f09c6c2907e8b49239a4167a4f0a4e766b7b9ce4ace2",
          "structural_path": "$",
          "line": 0,
          "column": 0,
          "end_line": 0,
          "end_column": 0,
          "name": "",
          "value": ""
        },
        "event_id": "4be15b56cb6f9965675695cc2e9d302080b3ab6a19a4220ea5ba5b62c5db9e08"
      }
    },
    "cpg.edges.v1": {
      "source": "Kafka broker via read_committed kafka-console-consumer",
      "key": "d97f48514682f65bbab6c7370668f14c95ae9823da85cbc9219fbc8b93ddccd2",
      "value": {
        "schema_version": "1.0",
        "event_time": "2026-07-20T05:56:53.556796Z",
        "repo_id": "huggingface/optimum",
        "file_id": "c6ae6f5556f2b93b05a9f09c6c2907e8b49239a4167a4f0a4e766b7b9ce4ace2",
        "run_id": "0e24e3e515da407eb97fb170c9e4fa69",
        "content_hash": "d9981103fcb1b057d82d44e24781f1e0547d9dca5212450da54eac55089a777a",
        "op": "upsert",
        "edge": {
          "id": "d97f48514682f65bbab6c7370668f14c95ae9823da85cbc9219fbc8b93ddccd2",
          "kind": "AST",
          "source_id": "b6569b0fda5380bcc1f06d903ea04c6654a7795938904c1a0fce0061449165d3",
          "target_id": "7f05fd0b21478c9a2be67c7504270e8ed535def48ccf860a4754c9e805ee8e0e",
          "file_id": "c6ae6f5556f2b93b05a9f09c6c2907e8b49239a4167a4f0a4e766b7b9ce4ace2",
          "discriminator": "body[0]",
          "variable": "",
          "resolved": true
        },
        "event_id": "0557614d2fa1b692e02c5702e214d226467ee3cd28b84e22127ef7b51b74262d"
      }
    },
    "cpg.source-metadata.v1": {
      "source": "Kafka broker via read_committed kafka-console-consumer",
      "key": "c6ae6f5556f2b93b05a9f09c6c2907e8b49239a4167a4f0a4e766b7b9ce4ace2",
      "value": {
        "schema_version": "1.0",
        "event_time": "2026-07-20T05:56:53.556796Z",
        "repo_id": "huggingface/optimum",
        "file_id": "c6ae6f5556f2b93b05a9f09c6c2907e8b49239a4167a4f0a4e766b7b9ce4ace2",
        "run_id": "0e24e3e515da407eb97fb170c9e4fa69",
        "content_hash": "d9981103fcb1b057d82d44e24781f1e0547d9dca5212450da54eac55089a777a",
        "op": "upsert",
        "metadata": {
          "_id": "c6ae6f5556f2b93b05a9f09c6c2907e8b49239a4167a4f0a4e766b7b9ce4ace2",
          "repo_id": "huggingface/optimum",
          "repo_url": "https://github.com/huggingface/optimum.git",
          "path": "docs/combine_docs.py",
          "content_hash": "d9981103fcb1b057d82d44e24781f1e0547d9dca5212450da54eac55089a777a",
          "size_bytes": 7449,
          "line_count": 185,
          "commit_sha": "a6c775e11118d62712057bd3a8c5649898a5312d",
          "parse_status": "ok",
          "node_counts": {
            "AST": 590,
            "SYNTHETIC": 10,
            "EXTERNAL": 43
          },
          "edge_counts": {
            "AST": 589,
            "CFG": 81,
            "DFG": 101,
            "CALL": 33
          },
          "warnings": [],
          "error_message": "",
          "processed_at": "2026-07-20T05:56:53.556796Z",
          "run_id": "0e24e3e515da407eb97fb170c9e4fa69",
          "schema_version": "1.0"
        },
        "event_id": "d098699248fd6c7aa3f866ba65db97bd9de07887fe69a3332d5628c7c49e2840"
      }
    },
    "cpg.parser-errors.v1": {
      "source": "Kafka broker via read_committed kafka-console-consumer",
      "key": "92652beab5b1746ace861f951d9fb677ac613307ed66109de753d7d792d9cf8b",
      "value": {
        "schema_version": "1.0",
        "event_time": "2026-07-24T08:44:38.512347Z",
        "repo_id": "fixture/invalid",
        "file_id": "588c74ea0f8771aa5a93280dd7211bd83afc52bf9e65d495c6cc6549d74705d4",
        "run_id": "cb01d4d1c745418faff76b4c5aa64c5a",
        "content_hash": "599a559122e3d4740cd8d47ecc76045c0c2310653235cfc102190b8f96f2182f",
        "op": "error",
        "event_id": "92652beab5b1746ace861f951d9fb677ac613307ed66109de753d7d792d9cf8b",
        "error": {
          "id": "92652beab5b1746ace861f951d9fb677ac613307ed66109de753d7d792d9cf8b",
          "stage": "parse",
          "exception_type": "SyntaxError",
          "message": "invalid syntax (broken.py, line 1)",
          "line": 1,
          "column": 12,
          "recoverable": true,
          "traceback": "File \"broken.py\", line 1\n    def broken(:\n               ^\nSyntaxError: invalid syntax"
        }
      }
    }
  },
  "preflight_sync": {
    "parser": {
      "path": "optimum/version.py",
      "file_id": "867c06c1f6e594bef9a16137312503a0870399626a16dded522ce7a24143b1a7",
      "content_hash": "079eca803ea5bfe068bc805997b013cc14c9ddc8629a2ec634d12bcebb6720ce",
      "status": "processed",
      "nodes": 29,
      "edges": 36,
      "deleted_nodes": 0,
      "deleted_edges": 0,
      "warnings": 0,
      "error": ""
    },
    "mongo_offset": 262
  },
  "stages": {
    "baseline": {
      "name": "baseline",
      "captured_at": "2026-07-24T08:45:17.923936Z",
      "source_hash": "ac342f9e8fd3f74b822e8d7399806be6f17b733b37e1a01ae24a486ba8d330ce",
      "source_lines": 15,
      "parser": {
        "path": "optimum/version.py",
        "file_id": "867c06c1f6e594bef9a16137312503a0870399626a16dded522ce7a24143b1a7",
        "content_hash": "ac342f9e8fd3f74b822e8d7399806be6f17b733b37e1a01ae24a486ba8d330ce",
        "status": "processed",
        "nodes": 7,
        "edges": 6,
        "deleted_nodes": 22,
        "deleted_edges": 31,
        "warnings": 0,
        "error": ""
      },
      "neo4j": {
        "nodes": 62528,
        "unique_nodes": 62528,
        "edges": 77843,
        "unique_edges": 77843,
        "file_nodes": 7,
        "file_edges": 6,
        "edge_kinds": {
          "AST": 57940,
          "CALL": 2593,
          "CFG": 7241,
          "DFG": 10069
        }
      },
      "mongo": {
        "documents": 61,
        "distinct_files": 61,
        "document": {
          "_id": "867c06c1f6e594bef9a16137312503a0870399626a16dded522ce7a24143b1a7",
          "path": "optimum/version.py",
          "content_hash": "ac342f9e8fd3f74b822e8d7399806be6f17b733b37e1a01ae24a486ba8d330ce",
          "node_counts": {
            "AST": 5,
            "SYNTHETIC": 2
          },
          "edge_counts": {
            "AST": 4,
            "CFG": 2
          },
          "processed_at": "2026-07-24T08:45:02.611370Z",
          "run_id": "48132d8db71c4fcfba0940b3c316f0c3",
          "kafka_offset": 264
        },
        "other_documents_count": 60,
        "other_documents_digest": "af261b6bad97801b111b28d3764f9ef0bd665208de72d923358769e54e83cdb9"
      },
      "kafka_metadata_end_offset": 266,
      "spark_checkpoint_offset": 266
    },
    "modified": {
      "name": "modified",
      "captured_at": "2026-07-24T08:45:42.296436Z",
      "source_hash": "079eca803ea5bfe068bc805997b013cc14c9ddc8629a2ec634d12bcebb6720ce",
      "source_lines": 22,
      "parser": {
        "path": "optimum/version.py",
        "file_id": "867c06c1f6e594bef9a16137312503a0870399626a16dded522ce7a24143b1a7",
        "content_hash": "079eca803ea5bfe068bc805997b013cc14c9ddc8629a2ec634d12bcebb6720ce",
        "status": "processed",
        "nodes": 29,
        "edges": 36,
        "deleted_nodes": 0,
        "deleted_edges": 1,
        "warnings": 0,
        "error": ""
      },
      "neo4j": {
        "nodes": 62550,